<?xml version="1.0" encoding="UTF-8"?>
<!ELEMENT utenti (utente+)>
<!ELEMENT utente (username, avatar)>
<!ELEMENT username (#PCDATA)>
<!ELEMENT avatar (#PCDATA)>
